{
  "version": 1,
  "mapperId": "lpa-request-mapper",
  "savedAt": "2026-08-03T02:45:00.000Z",
  "source": {
    "method": "manual",
    "root": {
      "id": "src-root",
      "name": "LoanApplicationRequest",
      "type": "object",
      "required": false,
      "children": [
        {
          "id": "src-ref",
          "name": "refNumber",
          "type": "string",
          "required": false,
          "children": []
        },
        {
          "id": "src-applicant",
          "name": "applicant",
          "type": "object",
          "required": false,
          "children": [
            {
              "id": "src-displayName",
              "name": "displayName",
              "type": "string",
              "required": false,
              "children": []
            },
            {
              "id": "src-dob",
              "name": "dateOfBirth",
              "type": "string",
              "required": false,
              "children": []
            },
            {
              "id": "src-govid",
              "name": "governmentId",
              "type": "string",
              "required": false,
              "children": []
            }
          ]
        },
        {
          "id": "src-mortgage",
          "name": "mortgage",
          "type": "object",
          "required": false,
          "children": [
            {
              "id": "src-amount",
              "name": "amount",
              "type": "number",
              "required": false,
              "children": []
            },
            {
              "id": "src-rate",
              "name": "ratePercent",
              "type": "number",
              "required": false,
              "children": []
            },
            {
              "id": "src-purpose",
              "name": "purpose",
              "type": "string",
              "required": false,
              "children": []
            },
            {
              "id": "src-term",
              "name": "termYears",
              "type": "integer",
              "required": false,
              "children": []
            }
          ]
        },
        {
          "id": "src-property",
          "name": "property",
          "type": "object",
          "required": false,
          "children": [
            {
              "id": "src-street",
              "name": "street",
              "type": "string",
              "required": false,
              "children": []
            },
            {
              "id": "src-city",
              "name": "city",
              "type": "string",
              "required": false,
              "children": []
            },
            {
              "id": "src-region",
              "name": "region",
              "type": "string",
              "required": false,
              "children": []
            },
            {
              "id": "src-postal",
              "name": "postalCode",
              "type": "string",
              "required": false,
              "children": []
            }
          ]
        }
      ]
    }
  },
  "target": {
    "method": "manual",
    "root": {
      "id": "tgt-root",
      "name": "LpaMappedResponse",
      "type": "object",
      "required": false,
      "children": [
        {
          "id": "tgt-message",
          "name": "MESSAGE",
          "type": "object",
          "required": false,
          "children": [
            {
              "id": "tgt-mismo",
              "name": "MISMOReferenceModelIdentifier",
              "type": "string",
              "required": false,
              "children": []
            },
            {
              "id": "tgt-dataver",
              "name": "DataVersionIdentifier",
              "type": "string",
              "required": false,
              "children": []
            },
            {
              "id": "tgt-deal",
              "name": "DEAL",
              "type": "object",
              "required": false,
              "children": [
                {
                  "id": "tgt-loan",
                  "name": "LOAN",
                  "type": "object",
                  "required": false,
                  "children": [
                    {
                      "id": "tgt-loanid",
                      "name": "LoanIdentifier",
                      "type": "string",
                      "required": false,
                      "children": []
                    },
                    {
                      "id": "tgt-note",
                      "name": "NoteAmount",
                      "type": "number",
                      "required": false,
                      "children": []
                    },
                    {
                      "id": "tgt-purpose",
                      "name": "LoanPurposeType",
                      "type": "string",
                      "required": false,
                      "children": []
                    },
                    {
                      "id": "tgt-maturity",
                      "name": "LoanMaturityPeriodCount",
                      "type": "integer",
                      "required": false,
                      "children": []
                    }
                  ]
                },
                {
                  "id": "tgt-party",
                  "name": "PARTY",
                  "type": "object",
                  "required": false,
                  "children": [
                    {
                      "id": "tgt-first",
                      "name": "FirstName",
                      "type": "string",
                      "required": false,
                      "children": []
                    },
                    {
                      "id": "tgt-last",
                      "name": "LastName",
                      "type": "string",
                      "required": false,
                      "children": []
                    },
                    {
                      "id": "tgt-full",
                      "name": "FullName",
                      "type": "string",
                      "required": false,
                      "children": []
                    },
                    {
                      "id": "tgt-role",
                      "name": "PartyRoleType",
                      "type": "string",
                      "required": false,
                      "children": []
                    },
                    {
                      "id": "tgt-birth",
                      "name": "BorrowerBirthDate",
                      "type": "string",
                      "required": false,
                      "children": []
                    }
                  ]
                },
                {
                  "id": "tgt-collateral",
                  "name": "COLLATERAL",
                  "type": "object",
                  "required": false,
                  "children": [
                    {
                      "id": "tgt-addr",
                      "name": "AddressLineText",
                      "type": "string",
                      "required": false,
                      "children": []
                    },
                    {
                      "id": "tgt-city",
                      "name": "CityName",
                      "type": "string",
                      "required": false,
                      "children": []
                    },
                    {
                      "id": "tgt-state",
                      "name": "StateCode",
                      "type": "string",
                      "required": false,
                      "children": []
                    },
                    {
                      "id": "tgt-postal",
                      "name": "PostalCode",
                      "type": "string",
                      "required": false,
                      "children": []
                    }
                  ]
                }
              ]
            }
          ]
        }
      ]
    }
  }
}
